title,Journal,category
Sandwich chain Subway explores sale of business,BBC,business
"How to start a vending-machine business, find locations",Business Insider,business
Blizzard president sends a message | This Week in Business,GamesIndustry.biz,business
"Business owner, 26, brings Mexican flavor to Madison",Norfolk Daily News,business
Houston Business Journal names 2023 Diversity in Business Awards honorees,Houston Business Journal,business
Town of Marion sees tremendous success from local businesses,WCYB,business
The Better Business Bureau is warning people about this Texas company,KXAN.com,business
PayPal and Shopify See Big Business in Returns. Merchants Want to Fix the Problem Themselves,The Information,business
Maryland Gov. Wes Moore orders state agencies to report Minority Business Enterprise program data,Baltimore Sun,business
"34-year-old lived on $19,000/year as a waitress. Now she runs a $100,000 business and makes $27,000 in passive income",CNBC,business
15 Tips To Help New Business Owners Worry Less About Money,Forbes,business
A New Formula For Businesses To Follow In Pursuit Of Profit,Forbes,business
How To Start A Business In Hawaii (2023 Guide),Forbes,business
Hugh Weber named Sounders president of business operations,Sounder At Heart,business
Trying To Define Your Business's Niche? 10 Questions To Ask Yourself,Forbes,business
What Those In The Entertainment Business Should Know Before Doing Business In Saudi Arabia,Forbes,business
The Unfinished Business of International Business Tax Reform,International Monetary Fund,business
5 Misconceptions Of Business Podcasting,Forbes,business
ADNOC to float 4% of its gas business in IPO -statement,Reuters,business
Customizable or Configurable? Find the Right Collections Solution ...,insideARM.com,business
"Tampa Bay Wave opens new office, marks a decade in business",Tampa Bay Times,business
How Conventional Business Wisdom Might Be Draining Your Team,Forbes,business
READOUT: Deputy Secretary of the Treasury Wally Adeyemo and ...,Treasury,business
10 Long Island schools are finalists in business plan competition,Long Island Business News,business
Boeing to move historic financing arm under jet business,Reuters,business
Internal Mobility: The Missing Piece Of 2023 Business Strategy,Forbes,business
Exclusive: U.S. sanctions authority asks Raiffeisen about Russia ...,Reuters,business
Kansas Family Business Forum welcomes new director | Wichita ...,Wichita State University,business
Black Owned Business Expo set for Feb. 25,Fayetteville Flyer,business
Nestle sees tough choices ahead,Food Business News,business
Could This Under-the-Radar Business Take Alphabet's Stock to the ...,The Motley Fool,business
Governor Moore Signs Executive Order to Strengthen Government ...,Governor Larry Hogan,business
"More prize money, a new home, growing business. What’s next for Black-owned Rock Hill biz",Rock Hill Herald,business
How Understanding The Nuances Of Human Behavior Could Help Your Business' Bottom Line,Forbes,business
Another photography business goes out of business,KVLY,business
Top Chinese investment banker Bao Fan is latest CEO to go missing,CNN,business
How Can Small Businesses Handle Finances And Create Accountability?,Forbes,business
Moore About Business: Airglades International Airport coming to ...,news.wgcu.org,business
Risky Business: SEC Expands DCP Enforcement Using Company ...,Holland & Knight,business
OpenText Fuels Business 2030 with Cloud Editions 23.1 Release,PR Newswire,business
"GFT CEO Plans To Double U.S. Business, Leverage ChatGPT",CRN,business
LaRose Announces Record for New Business Creation,Ohio Secretary of State,business
"L. William ""Bill"" Crotty passes away at 95",Dayton Business Journal,business
'Get rid of toxic people' in your business is needed yet difficult advice,Mitchell Republic,business
"Steak Dinners, Sales Reps and Risky Procedures: Inside the Big ...",ProPublica,business
"Semi crashes into another semi, then business near West Plains, Mo.",KAIT,business
Chicago mayoral candidates openly signal outside money spending,Crain's Chicago Business,business
Post-Pandemic Trends In Consumer Behavior: What Small Businesses Need To Know,Forbes,business
Soft skills: How well-rounded IT pros can push your business forward,The Enterprisers Project,business
China says it's 'open for business' after zero-covid. How open is it?,Grid,business
Securing industrial components with a business-first mindset,SC Media,business
New business Cascade Creek Company offers home improvement ...,wtip.org,business
"Missouri Democratic Party chair resigns, cites business demands ...",Missouri Independent,business
"Business Calendar for February 17, 2023",Rochester Business Journal,business
Airbus Wants Part Of Atos’ Evidian Cybersecurity Business,CRN,business
6 Quotes on business & personal finance from a bootstrapped-to ...,Silicon Valley Bank,business
Governor Abbott Highlights Ongoing Support For Texas Small ...,Office of the Texas Governor,business
"GitHub Copilot for Business, now in public release, weaves in security",Cybersecurity Dive,business
Truist sells stake in one of its business lines for $2 billion to private equity firm,Charlotte Observer,business
"Now at Harvard Business School: The South Sea Bubble, 1720 ...",hbs.edu,business
Why a noncompete ban could upend business for health providers ...,Washington Business Journal,business
"With $1.1B EnVen Takeover, Talos Positions for ‘More Competitive ...",Natural Gas Intelligence,business
Nine Ways Any Business Can Improve The Quality Of Their Video Marketing,Forbes,business
"Fly in business class to Germany and Belgium for less than $3,000",The Points Guy,business
Labcorp's spinoff CRO business gets a name—Fortrea,FierceBiotech,business
"Affordable housing good for business, community",Milwaukee ...,business
"Louisiana may bar more banks from state business over gun, energy policies",Greater Baton Rouge Business Report,business
Nominations sought for Business Person of the Year awards,Rochester Business Journal,business
DirecTV tells GOP senators it dropped Newsmax as part of ‘typical business dispute’,The Hill,business
Brookfield says Diplomat Hotel sale was a business plan executed,PERE,business
4 barbecue family feuds in Texas,The Dallas Morning News,business
"NBA, LegalZoom provide minorities with opportunity to scale their ...",NBA.com,business
General Motors Digs Into Mining Business to Lead Race for EV Metals,Bloomberg,business
"DoorDash's Q4 Beat Underscores Success Of Loyalty Business, Synergies From Wolt",Yahoo Finance,business
"SWAV Stock: Earnings Skyrocket 991%, Blowing Away Projections",Investor's Business Daily,business
HILL TAX BRIEFING: Farm Bill Spurs Hope for Business Tax Breaks,Bloomberg Tax,business
"Business Highlights: Goldilocks consumers, a surly chatbot",The Associated Press,business
Black business expo to pop-up in White Plains this weekend,News 12 Westchester,business
The Harvard Business School Prof Who Acted Like A Jerk & Lost ...,Poets&Quants,business
Business Groups Push for EU Platform Tax Rule Flexibility,Bloomberg Tax,business
Annie's Tap House open for business in Great Falls,KRTV NEWS Great Falls,business
The Family Business,California Golden Bears Athletics,business
Placerville residents fear new road proposal may hurt local business,CBS Sacramento,business
2023 Fast50 Awards,Boston Business Journal,business
National Arab Orchestra sells out Kennedy Center,Crain's Detroit Business,business
"Winter storm slows business, makes for long days for Omaha plow crews",WOWT,business
"Sony Film Chief Tom Rothman Talks Theater Business, Writers Strike",Business Insider,business
"Tesla recalling nearly 363,000 vehicles equipped with 'Full Self-Driving'",CNN,business
Meta's chief business officer will leave the company after 13 years,CNBC,business
Pickup abandoned in woods along edge of Joplin Business Park,KoamNewsNow.com,business
Telecom Italia sees return to core profit growth as home business ...,Reuters.com,business
"Business owners, MPD push to make east side shopping center ...",WKOW,business
