title,Journal,category
Ledge aims to build automation tools for finance teams,TechCrunch,finance
How Embedded Finance Can Unlock Funding For Female Founders,Forbes,finance
"With Financial Turmoil At Bally Sports Networks, Major Leagues Gear Up For A Future Without Cable",Forbes,finance
"Investors recognising clubs' value ahead of Man Utd bids, says finance expert",Reuters,finance
Visa Finance Chief Vasant Prabhu to Depart in September,The Wall Street Journal,finance
Campaign finance records show where the money is flowing in upcoming Colorado Springs election,Colorado Springs Gazette,finance
"U.S. to push debt relief, Ukraine aid at G20 finance meeting in India",Reuters,finance
Novato appoints finance director to City Council,Marin Independent Journal,finance
Analysis: Lessors lead rush to finance huge Air India jet order,Reuters.com,finance
Digital Innovations Are Modernizing Car Shopping. Why Isn’t Automotive Finance Next?,PaymentsJournal,finance
6 Quotes on business & personal finance from a bootstrapped-to ...,Silicon Valley Bank,finance
Takeaways from the 12th Annual Global Fund Finance Symposium,Ropes & Gray LLP,finance
How Can Small Businesses Handle Finances And Create Accountability?,Forbes,finance
FSB to more closely scrutinize decentralized finance | ABA Banking ...,ABA Banking Journal,finance
German finance minister plans multi-billion-euro relief package for ...,Reuters.com,finance
The Legal 500 Deutschland 2023 Recognizes Goodwin for Finance ...,Goodwin Procter,finance
Boeing to move historic financing arm under jet business,Reuters,finance
Reed City board considering finance software Questica,The Pioneer,finance
Visa's finance chief Vasant Prabhu to leave payments giant,Reuters,finance
Why there is no such thing as a 'no landing' scenario for the economy: Morning Brief,Yahoo Finance,finance
Edwards Named Vice President for Finance and Administration ...,Western Illinois University News,finance
2022 Year in Review and Look Ahead Crossover With The ...,Troutman Pepper,finance
King Of The Office: Finance And Insurance Replace Big Tech For ...,Yahoo Finance,finance
"IDB Bank Expands Sponsor & Leverage Finance Team, Dunleavy to ...",ABL Advisor,finance
How financial composure can assist you in accumulating wealth? | Mint,Mint,finance
Finance Manager for North-West Syria,Syrian Arab Republic,finance
A How-To Guide For Setting Clear & Firm Financial Boundaries,mindbodygreen,finance
Grand Rapids Community Media Center names finance manager,Grand Rapids Business Journal,finance
Toward sustainable finance in Asia: Deforestation and due diligence,PRI,finance
Dwight Capital & Dwight Mortgage Trust Finance Over $168.9MM in ...,businesswire.com,finance
GBBC Digital Finance joins international securities organization as an affiliate member,Cointelegraph,finance
Troubling signs emerge as credit card debt hits record high,Yahoo Finance,finance
Will finance chiefs need to rethink their remit in 2023?,Raconteur,finance
How Solvency Check Error Led to USP Depegging on Avalanche ...,CoinDesk,finance
PBOC Governor In Focus as Financial Leadership Reshuffle Nears,Bloomberg,finance
2022 Year in Review and Look Ahead Crossover With The ...,JD Supra,finance
Fitch Rates Macquarie International Finance's CP Programme at 'F1 ...,Fitch Ratings,finance
Podcast | Supply Chain Finance Today: It's a Whole New Conversation,SupplyChainBrain,finance
North Dakota lawmakers toss bills to boost campaign finance ...,INFORUM,finance
Remarks by Assistant Secretary for Financial Institutions Graham ...,Treasury,finance
Investment bank China Renaissance reassures staff after founder ...,Financial Times,finance
Coventry City of Culture: Urgent meeting called on trust finances,BBC,finance
"Cyclone Adds to New Zealand's Economic Challenges, Finance ...",Bloomberg,finance
Fluid Finance partners Sumsub to prevent fraud and improve ...,The Paypers,finance
Financial Audit: FY 2022 and FY 2021 Consolidated Financial ...,Government Accountability Office,finance
Socure plans to ‘eliminate synthetic identities’ from US finance,Biometric Update,finance
"Stock market news today: Stock futures waver, bitcoin rallies",Yahoo Finance,finance
Stamford finance board questions school's AC cost comparison,The Advocate,finance
LIBN’s Who’s Who Banking & Finance 2023,Long Island Business News,finance
Chairman's News | Newsroom | The United States Senate ...,Hearing | Hearings | The United States Senate Committee on Finance,finance
Campaign finance reports for governor's race show Jeff Landry with ...,WBRZ,finance
$30 million plan to help finance Northwestern Mutual project endorsed,Milwaukee Journal Sentinel,finance
Recent health care deal is a win for retirees. The finances of ...,The Globe and Mail,finance
Retail investors are pouring a record $1.5 billion per day into the stock market,Yahoo Finance,finance
Big Law Balks at Litigation Finance Deals Seen as Too Pricey,Bloomberg Law,finance
RCI Banque 2022 Annual Results: MOBILIZE FINANCIAL ...,Yahoo Finance,finance
Environment Secretary: Private finance should power nature goals,BusinessGreen,finance
China Buy Now Pay Later Business Report 2023 Featuring Tencent ...,businesswire.com,finance
"NA discusses finance bill, set to vote on it later today",DAWN.com,finance
Senate Finance Committee passes wildlife corridors fund,New Mexico Political Report,finance
Michigan Medicine names new chief financial officer | The University ...,The University Record,finance
Stock market news today: Stocks rise after strong retail sales data,Yahoo Finance,finance
US Crackdown Seeks to Push Crypto Back to the Fringes of Finance,Bloomberg,finance
The Office of Financial Aid & Scholarships,citadel.edu,finance
Ranking Member's News | Newsroom | The United States Senate ...,Hearing | Hearings | The United States Senate Committee on Finance,finance
MN House Education Finance Committee passes legal cannabis bill,KFGO,finance
The Uneasy Dance Between the Markets and the Fed,The New York Times,finance
"DraftKings stock soars after Q4 revenue beat, narrower-than ...",Yahoo Finance,finance
The Effect of Interest Rates on Personal Finance: A Time-Series ...,Investing.com India,finance
Looking for a new job? New rules may save you from the AI hiring bots.,Yahoo Finance,finance
Personal finance advice: My father-in-law claims he's saving so ...,Slate,finance
Consumer Financial Protection Bureau's fate is again in the hands of the Supreme Court,CNN,finance
Looking to Improve Your Finances in 2023? Check Out These ...,Yahoo Finance,finance
Shopping mall owners fill empty spaces with apartments,Finance and Commerce,finance
Ohio train derailment: Expert calls out officials for not being ‘forthright and transparent enough’,Yahoo Finance,finance
Payoneer receives UK E-Money license from Financial Conduct Authority,Yahoo Finance,finance
City of Hilliard fires finance director after phishing scam resulted in ...,The Business Journals,finance
Lido Finance Kicks Off Yield Farming Event on Ethereum Scaler ...,Decrypt,finance
Personal Finance Tips for the Year of the Rabbit,Kiplinger's Personal Finance,finance
Personal Finance: Treasury Bill Rates at 5% Are No Bargain,Bloomberg,finance
QuantumScape Reports Fourth Quarter 2022 Business and ...,Yahoo Finance,finance
Charlie Munger: 'I'm not proud of my country' for allowing 'crypto sh-t',Yahoo Finance,finance
The financial system is alarmingly vulnerable to cyber attack,Financial Times,finance
"Germans worry about inflation, say it causes financial pain",survey,finance
5 Predictions For Corporate Finance In 2023,Forbes,finance
"The future of finance will include generative A.I., says an MIT researcher",Fortune,finance
BofA Says Says Hard Landing to Hit Stocks in Second Half,Yahoo Finance,finance
4 misleading personal finance tips,Big Think,finance
Boeing to slash about 2000 white-collar jobs in finance and HR,The Seattle Times,finance
Shein gives investors lofty revenue projections as it prepares for IPO,Financial Times,finance
Motor & General Finance reports consolidated net loss of Rs 0.47 crore in the December 2022 quarter,Business Standard,finance
Improving patient safety shouldn't be a financial calculation,STAT,finance
How to Finance Your Investment Property & Make Money,Yahoo Finance,finance
YouTube CEO Susan Wojcicki stepping down,Yahoo Finance,finance
"Stocks moving in after-hours: Roku, Zillow, Cisco, Shopify",Yahoo Finance,finance
Federal Funds to Benefit Homeless in Prince of Wales,Alaska Housing Finance Corporation,finance
300 Years of Financial Advice Basically Tells You the Same Thing,Bloomberg,finance
